{
  "$schema": "https://json-schema.org/draft/2020-12/schema",
  "title": "Dungeon One combat adventure v2",
  "type": "object",
  "properties": {
    "schemaVersion": {
      "type": "integer",
      "const": 2
    },
    "id": {
      "type": "string",
      "minLength": 1,
      "maxLength": 64,
      "pattern": "^[a-z][a-z0-9]*(?:-[a-z0-9]+)*$"
    },
    "contentVersion": {
      "type": "string",
      "minLength": 1,
      "maxLength": 64,
      "pattern": "^[a-z0-9][a-z0-9.-]*$"
    },
    "rulesVersion": {
      "type": "string",
      "const": "signet-rules-v1"
    },
    "title": {
      "type": "string",
      "minLength": 1,
      "maxLength": 4096
    },
    "introduction": {
      "type": "string",
      "minLength": 1,
      "maxLength": 4096
    },
    "objective": {
      "type": "string",
      "minLength": 1,
      "maxLength": 4096
    },
    "player": {
      "type": "object",
      "properties": {
        "locationId": {
          "type": "string",
          "minLength": 1,
          "maxLength": 64,
          "pattern": "^[a-z][a-z0-9]*(?:-[a-z0-9]+)*$"
        },
        "hp": {
          "type": "integer",
          "minimum": 1,
          "maximum": 10000
        },
        "maxHp": {
          "type": "integer",
          "minimum": 1,
          "maximum": 10000
        },
        "armorClass": {
          "type": "integer",
          "minimum": 1,
          "maximum": 100
        },
        "attackBonus": {
          "type": "integer",
          "minimum": -20,
          "maximum": 100
        },
        "initiativeBonus": {
          "type": "integer",
          "minimum": -20,
          "maximum": 100
        },
        "weaponId": {
          "type": "string",
          "minLength": 1,
          "maxLength": 64,
          "pattern": "^[a-z][a-z0-9]*(?:-[a-z0-9]+)*$"
        }
      },
      "required": [
        "locationId",
        "hp",
        "maxHp",
        "armorClass",
        "attackBonus",
        "initiativeBonus",
        "weaponId"
      ],
      "additionalProperties": false
    },
    "locations": {
      "type": "array",
      "items": {
        "type": "object",
        "properties": {
          "id": {
            "type": "string",
            "minLength": 1,
            "maxLength": 64,
            "pattern": "^[a-z][a-z0-9]*(?:-[a-z0-9]+)*$"
          },
          "name": {
            "type": "string",
            "minLength": 1,
            "maxLength": 4096
          },
          "description": {
            "type": "string",
            "minLength": 1,
            "maxLength": 4096
          },
          "aliases": {
            "type": "array",
            "minItems": 1,
            "maxItems": 32,
            "items": {
              "type": "string",
              "minLength": 1,
              "maxLength": 128,
              "pattern": "^[a-z][a-z0-9]*(?:-[a-z0-9]+)*(?: [a-z][a-z0-9]*(?:-[a-z0-9]+)*){0,7}$"
            }
          }
        },
        "required": ["id", "name", "description", "aliases"],
        "additionalProperties": false
      },
      "minItems": 1,
      "maxItems": 256
    },
    "connections": {
      "type": "array",
      "items": {
        "type": "object",
        "properties": {
          "id": {
            "type": "string",
            "minLength": 1,
            "maxLength": 64,
            "pattern": "^[a-z][a-z0-9]*(?:-[a-z0-9]+)*$"
          },
          "from": {
            "type": "string",
            "minLength": 1,
            "maxLength": 64,
            "pattern": "^[a-z][a-z0-9]*(?:-[a-z0-9]+)*$"
          },
          "to": {
            "type": "string",
            "minLength": 1,
            "maxLength": 64,
            "pattern": "^[a-z][a-z0-9]*(?:-[a-z0-9]+)*$"
          }
        },
        "required": ["id", "from", "to"],
        "additionalProperties": false
      },
      "minItems": 0,
      "maxItems": 256
    },
    "features": {
      "type": "array",
      "items": {
        "type": "object",
        "properties": {
          "id": {
            "type": "string",
            "minLength": 1,
            "maxLength": 64,
            "pattern": "^[a-z][a-z0-9]*(?:-[a-z0-9]+)*$"
          },
          "name": {
            "type": "string",
            "minLength": 1,
            "maxLength": 4096
          },
          "description": {
            "type": "string",
            "minLength": 1,
            "maxLength": 4096
          },
          "aliases": {
            "type": "array",
            "minItems": 1,
            "maxItems": 32,
            "items": {
              "type": "string",
              "minLength": 1,
              "maxLength": 128,
              "pattern": "^[a-z][a-z0-9]*(?:-[a-z0-9]+)*(?: [a-z][a-z0-9]*(?:-[a-z0-9]+)*){0,7}$"
            }
          },
          "locationId": {
            "type": "string",
            "minLength": 1,
            "maxLength": 64,
            "pattern": "^[a-z][a-z0-9]*(?:-[a-z0-9]+)*$"
          }
        },
        "required": ["id", "name", "description", "aliases", "locationId"],
        "additionalProperties": false
      },
      "minItems": 0,
      "maxItems": 256
    },
    "doors": {
      "type": "array",
      "items": {
        "type": "object",
        "properties": {
          "id": {
            "type": "string",
            "minLength": 1,
            "maxLength": 64,
            "pattern": "^[a-z][a-z0-9]*(?:-[a-z0-9]+)*$"
          },
          "name": {
            "type": "string",
            "minLength": 1,
            "maxLength": 4096
          },
          "description": {
            "type": "string",
            "minLength": 1,
            "maxLength": 4096
          },
          "aliases": {
            "type": "array",
            "minItems": 1,
            "maxItems": 32,
            "items": {
              "type": "string",
              "minLength": 1,
              "maxLength": 128,
              "pattern": "^[a-z][a-z0-9]*(?:-[a-z0-9]+)*(?: [a-z][a-z0-9]*(?:-[a-z0-9]+)*){0,7}$"
            }
          },
          "from": {
            "type": "string",
            "minLength": 1,
            "maxLength": 64,
            "pattern": "^[a-z][a-z0-9]*(?:-[a-z0-9]+)*$"
          },
          "to": {
            "type": "string",
            "minLength": 1,
            "maxLength": 64,
            "pattern": "^[a-z][a-z0-9]*(?:-[a-z0-9]+)*$"
          },
          "open": {
            "type": "integer",
            "minimum": 0,
            "maximum": 1
          }
        },
        "required": [
          "id",
          "name",
          "description",
          "aliases",
          "from",
          "to",
          "open"
        ],
        "additionalProperties": false
      },
      "minItems": 0,
      "maxItems": 256
    },
    "equipment": {
      "type": "array",
      "items": {
        "type": "object",
        "properties": {
          "id": {
            "type": "string",
            "minLength": 1,
            "maxLength": 64,
            "pattern": "^[a-z][a-z0-9]*(?:-[a-z0-9]+)*$"
          },
          "name": {
            "type": "string",
            "minLength": 1,
            "maxLength": 4096
          },
          "description": {
            "type": "string",
            "minLength": 1,
            "maxLength": 4096
          },
          "aliases": {
            "type": "array",
            "minItems": 1,
            "maxItems": 32,
            "items": {
              "type": "string",
              "minLength": 1,
              "maxLength": 128,
              "pattern": "^[a-z][a-z0-9]*(?:-[a-z0-9]+)*(?: [a-z][a-z0-9]*(?:-[a-z0-9]+)*){0,7}$"
            }
          },
          "damage": {
            "type": "object",
            "properties": {
              "dice": {
                "type": "integer",
                "minimum": 1,
                "maximum": 20
              },
              "sides": {
                "type": "integer",
                "minimum": 2,
                "maximum": 100
              },
              "modifier": {
                "type": "integer",
                "minimum": -20,
                "maximum": 100
              }
            },
            "required": ["dice", "sides", "modifier"],
            "additionalProperties": false
          }
        },
        "required": ["id", "name", "description", "aliases", "damage"],
        "additionalProperties": false
      },
      "minItems": 1,
      "maxItems": 256
    },
    "monsterDefinitions": {
      "type": "array",
      "items": {
        "type": "object",
        "properties": {
          "id": {
            "type": "string",
            "minLength": 1,
            "maxLength": 64,
            "pattern": "^[a-z][a-z0-9]*(?:-[a-z0-9]+)*$"
          },
          "name": {
            "type": "string",
            "minLength": 1,
            "maxLength": 4096
          },
          "description": {
            "type": "string",
            "minLength": 1,
            "maxLength": 4096
          },
          "aliases": {
            "type": "array",
            "minItems": 1,
            "maxItems": 32,
            "items": {
              "type": "string",
              "minLength": 1,
              "maxLength": 128,
              "pattern": "^[a-z][a-z0-9]*(?:-[a-z0-9]+)*(?: [a-z][a-z0-9]*(?:-[a-z0-9]+)*){0,7}$"
            }
          },
          "maxHp": {
            "type": "integer",
            "minimum": 1,
            "maximum": 10000
          },
          "armorClass": {
            "type": "integer",
            "minimum": 1,
            "maximum": 100
          },
          "attackBonus": {
            "type": "integer",
            "minimum": -20,
            "maximum": 100
          },
          "initiativeBonus": {
            "type": "integer",
            "minimum": -20,
            "maximum": 100
          },
          "attackName": {
            "type": "string",
            "minLength": 1,
            "maxLength": 4096
          },
          "damage": {
            "type": "object",
            "properties": {
              "dice": {
                "type": "integer",
                "minimum": 1,
                "maximum": 20
              },
              "sides": {
                "type": "integer",
                "minimum": 2,
                "maximum": 100
              },
              "modifier": {
                "type": "integer",
                "minimum": -20,
                "maximum": 100
              }
            },
            "required": ["dice", "sides", "modifier"],
            "additionalProperties": false
          }
        },
        "required": [
          "id",
          "name",
          "description",
          "aliases",
          "maxHp",
          "armorClass",
          "attackBonus",
          "initiativeBonus",
          "attackName",
          "damage"
        ],
        "additionalProperties": false
      },
      "minItems": 0,
      "maxItems": 256
    },
    "monsters": {
      "type": "array",
      "items": {
        "type": "object",
        "properties": {
          "id": {
            "type": "string",
            "minLength": 1,
            "maxLength": 64,
            "pattern": "^[a-z][a-z0-9]*(?:-[a-z0-9]+)*$"
          },
          "definitionId": {
            "type": "string",
            "minLength": 1,
            "maxLength": 64,
            "pattern": "^[a-z][a-z0-9]*(?:-[a-z0-9]+)*$"
          },
          "locationId": {
            "type": "string",
            "minLength": 1,
            "maxLength": 64,
            "pattern": "^[a-z][a-z0-9]*(?:-[a-z0-9]+)*$"
          },
          "hp": {
            "type": "integer",
            "minimum": 0,
            "maximum": 10000
          }
        },
        "required": ["id", "definitionId", "locationId", "hp"],
        "additionalProperties": false
      },
      "minItems": 0,
      "maxItems": 256
    },
    "items": {
      "type": "array",
      "items": {
        "type": "object",
        "properties": {
          "id": {
            "type": "string",
            "minLength": 1,
            "maxLength": 64,
            "pattern": "^[a-z][a-z0-9]*(?:-[a-z0-9]+)*$"
          },
          "name": {
            "type": "string",
            "minLength": 1,
            "maxLength": 4096
          },
          "description": {
            "type": "string",
            "minLength": 1,
            "maxLength": 4096
          },
          "aliases": {
            "type": "array",
            "minItems": 1,
            "maxItems": 32,
            "items": {
              "type": "string",
              "minLength": 1,
              "maxLength": 128,
              "pattern": "^[a-z][a-z0-9]*(?:-[a-z0-9]+)*(?: [a-z][a-z0-9]*(?:-[a-z0-9]+)*){0,7}$"
            }
          },
          "locationId": {
            "type": "string",
            "minLength": 1,
            "maxLength": 64,
            "pattern": "^[a-z][a-z0-9]*(?:-[a-z0-9]+)*$"
          },
          "featureId": {
            "type": "string",
            "minLength": 1,
            "maxLength": 64,
            "pattern": "^[a-z][a-z0-9]*(?:-[a-z0-9]+)*$"
          }
        },
        "required": [
          "id",
          "name",
          "description",
          "aliases",
          "locationId",
          "featureId"
        ],
        "additionalProperties": false
      },
      "minItems": 0,
      "maxItems": 256
    },
    "exit": {
      "type": "object",
      "properties": {
        "locationId": {
          "type": "string",
          "minLength": 1,
          "maxLength": 64,
          "pattern": "^[a-z][a-z0-9]*(?:-[a-z0-9]+)*$"
        },
        "requiredItemId": {
          "type": "string",
          "minLength": 1,
          "maxLength": 64,
          "pattern": "^[a-z][a-z0-9]*(?:-[a-z0-9]+)*$"
        },
        "name": {
          "type": "string",
          "minLength": 1,
          "maxLength": 4096
        },
        "aliases": {
          "type": "array",
          "minItems": 1,
          "maxItems": 32,
          "items": {
            "type": "string",
            "minLength": 1,
            "maxLength": 128,
            "pattern": "^[a-z][a-z0-9]*(?:-[a-z0-9]+)*(?: [a-z][a-z0-9]*(?:-[a-z0-9]+)*){0,7}$"
          }
        }
      },
      "required": ["locationId", "requiredItemId", "name", "aliases"],
      "additionalProperties": false
    }
  },
  "required": [
    "schemaVersion",
    "id",
    "contentVersion",
    "rulesVersion",
    "title",
    "introduction",
    "objective",
    "player",
    "locations",
    "connections",
    "features",
    "doors",
    "equipment",
    "monsterDefinitions",
    "monsters",
    "items",
    "exit"
  ],
  "additionalProperties": false
}
